<!DOCTYPE APPOINTMENT SYSTEM "b2_termin.dtd">
<APPOINTMENT id="A1" name="appointment_1" creator="P1" movable="true" serialized="false">
	<STARTDATE>
		<DATE>
			<DAY>26</DAY>
			<MONTH>4</MONTH>
			<YEAR>1999</YEAR>
		</DATE>
		<TIME>
			<HOUR>13</HOUR>
			<MINUTE>00</MINUTE>
		</TIME>
	</STARTDATE>
	<ENDDATE>
		<DATE>
			<DAY>26</DAY>
			<MONTH>4</MONTH>
			<YEAR>1999</YEAR>
		</DATE>
		<TIME>
			<HOUR>14</HOUR>
			<MINUTE>30</MINUTE>
		</TIME>
	</ENDDATE>
	<DURATION>
		1.50
	</DURATION>
	<APPOINTMENT_DESCRIPTION>
		<DESCRIPTION_TITLE> 
			Vorlesung Softwareentwicklung 2
		</DESCRIPTION_TITLE>
		<DESCRIPTION>
			Design Patterns
		</DESCRIPTION>
		<APPOINTMENT_TYPE>
			Lehre
		</APPOINTMENT_TYPE>
		<APPOINTMENT_LOCATION>
			HS 23
		</APPOINTMENT_LOCATION>
		<APPOINTMENT_LINK>
			http://www.google.at
		</APPOINTMENT_LINK>
	</APPOINTMENT_DESCRIPTION>
	<APPOINTMENT_NOTIFICATIONS>
		<NOTIFICATION type="EMail" period="day">
				1
			</NOTIFICATION>
		<NOTIFICATION type="Beep" period="day">
				1
			</NOTIFICATION>
	</APPOINTMENT_NOTIFICATIONS>
	<PARTICIPANT_LIST>
		<PARTICIPANT id="P1" name="Thomas Herzog" email="thomas.herzog@students.fh-hagenberg.at"/>
		<PARTICIPANT id="P2" name="Thomas Herzog" email="thomas.herzog@students.fh-hagenberg.at"/>
		<PARTICIPANT id="P3" name="Thomas Herzog" email="thomas.herzog@students.fh-hagenberg.at"/>
	</PARTICIPANT_LIST>
</APPOINTMENT>
